<?xml version="1.0" encoding="UTF-8"?>
<c:contactList xmlns:xsi="http://www.w3.org/2001/XMLSchema-instance"
        xmlns:c="http://www.example.org/contacts" xsi:schemaLocation="http://www.example.org/contacts contacts.xsd ">
        <c:contact>
                <c:id>0</c:id>
                <c:name>
                        <c:first>c:first</c:first>
                        <c:last>c:last</c:last>
                </c:name>
                <c:phone>
                        <c:number>c:number</c:number>
                </c:phone>
                <c:phone>
                        <c:number>c:numberY</c:number>
                </c:phone>
                <c:address>
                        <c:street>c:street</c:street>
                        <c:city>c:city</c:city>
                        <c:state>c:state</c:state>
                        <c:zipCode>1</c:zipCode>
                </c:address>
                <c:address>
                        <c:street>c:streetY</c:street>
                        <c:city>c:city</c:city>
                        <c:state>c:state</c:state>
                        <c:zipCode>1</c:zipCode>
                </c:address>
        </c:contact>
        <c:contact>
                <c:id>1</c:id>
                <c:name>
                        <c:first>c:firstY</c:first>
                        <c:last>c:last</c:last>
                </c:name>
                <c:phone>
                        <c:number>c:number</c:number>
                </c:phone>
                <c:address>
                        <c:street>c:street</c:street>
                        <c:city>c:city</c:city>
                        <c:state>c:state</c:state>
                        <c:zipCode>1</c:zipCode>
                </c:address>
                <c:address>
                        <c:street>c:street</c:street>
                        <c:city>c:city</c:city>
                        <c:state>c:state</c:state>
                        <c:zipCode>11</c:zipCode>
                </c:address>
        </c:contact>
</c:contactList>